{
  "schemaVersion": "1.0.0",
  "stableId": "content.les.moral-prayer-foundations.distinctions.01",
  "phase3LessonId": "les.moral-prayer-foundations.distinctions.01",
  "programmeId": "prog.core-foundation",
  "subjectId": "subj.moral-prayer-foundations",
  "groupId": "grp.moral-prayer-foundations.distinctions",
  "title": "Object, Intention, Circumstances, Virtue, and Conscience",
  "slug": "moral-life-and-prayer-foundations-distinctions-01",
  "centralQuestion": "How should Catholic teaching understand Object, Intention, Circumstances, Virtue, and Conscience?",
  "learningObjectives": [
    "State a clear Catholic account of Object, Intention, Circumstances, Virtue, and Conscience in the context of Moral Life and Prayer Foundations.",
    "Distinguish the doctrinal, historical, philosophical, scientific, or disciplinary claims involved in Object, Intention, Circumstances, Virtue, and Conscience.",
    "Use the assigned Scripture, Catechism, Magisterial, historical, scholarly, and comparative sources within their proper competence.",
    "Present the strongest relevant objection fairly and give a proportionate Catholic response."
  ],
  "shortDirectAnswer": "Catholic teaching approaches Object, Intention, Circumstances, Virtue, and Conscience within Moral Life and Prayer Foundations: Completes the foundation route through beatitude, freedom, virtue, conscience, sin, commandments, prayer, and the universal call to holiness. It reads Scripture in the Church, applies Catechism and Magisterial distinctions, and separates revealed doctrine from discipline, opinion, and revisable historical or scientific judgment.",
  "fullExplanation": [
    {
      "type": "heading",
      "level": 2,
      "text": "Understanding Object, Intention, Circumstances, Virtue, and Conscience"
    },
    {
      "type": "paragraph",
      "text": "To study Object, Intention, Circumstances, Virtue, and Conscience, begin with the concrete claims made under Moral Life and Prayer Foundations. Completes the foundation route through beatitude, freedom, virtue, conscience, sin, commandments, prayer, and the universal call to holiness. The task is neither a loose anthology of citations nor an appeal to authority without reasoning. It is an ordered account in which Scripture is interpreted, Magisterial teaching is classified, historical evidence is contextualised, and scholarship is used within its discipline.",
      "sourceIds": [
        "src.ccc.main",
        "src.vatican2.gaudium-et-spes"
      ]
    },
    {
      "type": "heading",
      "level": 3,
      "text": "Biblical and canonical frame"
    },
    {
      "type": "paragraph",
      "text": "Object, Intention, Circumstances, Virtue, and Conscience is anchored in Matthew 5:1-48, Romans 12:1-21, Galatians 5:13-26. No protected translation wording is reproduced. Instead, each card states in fresh language what the passage contributes and leaves the reference visible for verification. The learner should read what precedes and follows, identify genre and speaker, and compare the proposed use with the wider canon.",
      "sourceIds": [
        "src.scripture.catholic-bible",
        "src.vatican2.dei-verbum"
      ]
    },
    {
      "type": "paragraph",
      "text": "The essential vocabulary for Object, Intention, Circumstances, Virtue, and Conscience is Virtue, Conscience, Sin, Prayer. Before declaring agreement or conflict, check whether sources use those terms in the same sense, address the same problem, and carry the same authority. Doctrinal, devotional, historical, and comparative language may overlap, but the lesson may not treat them as interchangeable.",
      "sourceIds": [
        "src.ccc.main",
        "src.vatican2.gaudium-et-spes"
      ]
    },
    {
      "type": "heading",
      "level": 3,
      "text": "Distinctions"
    },
    {
      "type": "paragraph",
      "text": "The work of this lesson is controlled distinction. Object, Intention, Circumstances, Virtue, and Conscience becomes confused when neighbouring terms are treated as synonyms or when a conclusion is granted more authority than its premises allow. Compare each proposition with the subject's doctrinal classifications, then ask whether the claim is revealed teaching, authoritative doctrine, discipline, permitted opinion, or a historical, philosophical, or scientific judgment. The distinction changes the evidence and assent required.",
      "sourceIds": [
        "src.ccc.main",
        "src.vatican2.gaudium-et-spes"
      ]
    },
    {
      "type": "heading",
      "level": 3,
      "text": "Lesson-specific focus"
    },
    {
      "type": "paragraph",
      "text": "The phrase Object matters specifically to Object, Intention, Circumstances, Virtue, and Conscience. Ask first what Object denotes here, next which contrast makes the term precise, and finally which evidence bears on it. A Catholic treatment of Object under Moral Life and Prayer Foundations should also state whether the resulting claim is doctrine, discipline, opinion, or specialist judgment.",
      "sourceIds": [
        "src.ccc.main",
        "src.vatican2.gaudium-et-spes"
      ]
    },
    {
      "type": "paragraph",
      "text": "The phrase Intention matters specifically to Object, Intention, Circumstances, Virtue, and Conscience. Ask first what Intention denotes here, next which contrast makes the term precise, and finally which evidence bears on it. A Catholic treatment of Intention under Moral Life and Prayer Foundations should also state whether the resulting claim is doctrine, discipline, opinion, or specialist judgment.",
      "sourceIds": [
        "src.ccc.main",
        "src.vatican2.gaudium-et-spes"
      ]
    },
    {
      "type": "paragraph",
      "text": "Object, Intention, Circumstances, Virtue, and Conscience uses Circumstances as a checkpoint for understanding. The learner should locate Circumstances in the assigned Scripture, compare its doctrinal treatment, and note historical development without forcing identical vocabulary. When Circumstances is disputed within Moral Life and Prayer Foundations, the strongest alternative meaning should be recorded before the Catholic response is evaluated.",
      "sourceIds": [
        "src.ccc.main",
        "src.vatican2.gaudium-et-spes"
      ]
    },
    {
      "type": "paragraph",
      "text": "Object, Intention, Circumstances, Virtue, and Conscience uses Virtue as a checkpoint for understanding. The learner should locate Virtue in the assigned Scripture, compare its doctrinal treatment, and note historical development without forcing identical vocabulary. When Virtue is disputed within Moral Life and Prayer Foundations, the strongest alternative meaning should be recorded before the Catholic response is evaluated.",
      "sourceIds": [
        "src.ccc.main",
        "src.vatican2.gaudium-et-spes"
      ]
    },
    {
      "type": "heading",
      "level": 3,
      "text": "Prerequisite integration"
    },
    {
      "type": "paragraph",
      "text": "For Object, Intention, Circumstances, Virtue, and Conscience, recall grace. Moral Life and Prayer Foundations uses grace in this lesson. Link grace with Baptism in Object, Intention, Circumstances, Virtue, and Conscience. Classify every grace claim in Object, Intention, Circumstances, Virtue, and Conscience. Check grace evidence for Moral Life and Prayer Foundations. Revise Object, Intention, Circumstances, Virtue, and Conscience if grace remains unclear.",
      "sourceIds": [
        "src.ccc.main",
        "src.vatican2.gaudium-et-spes"
      ]
    },
    {
      "type": "paragraph",
      "text": "For Object, Intention, Circumstances, Virtue, and Conscience, recall Baptism. Moral Life and Prayer Foundations uses Baptism in this lesson. Link Baptism with discipleship in Object, Intention, Circumstances, Virtue, and Conscience. Classify every Baptism claim in Object, Intention, Circumstances, Virtue, and Conscience. Check Baptism evidence for Moral Life and Prayer Foundations. Revise Object, Intention, Circumstances, Virtue, and Conscience if Baptism remains unclear.",
      "sourceIds": [
        "src.ccc.main",
        "src.vatican2.gaudium-et-spes"
      ]
    },
    {
      "type": "paragraph",
      "text": "For Object, Intention, Circumstances, Virtue, and Conscience, recall discipleship. Moral Life and Prayer Foundations uses discipleship in this lesson. Link discipleship with communion in Object, Intention, Circumstances, Virtue, and Conscience. Classify every discipleship claim in Object, Intention, Circumstances, Virtue, and Conscience. Check discipleship evidence for Moral Life and Prayer Foundations. Revise Object, Intention, Circumstances, Virtue, and Conscience if discipleship remains unclear.",
      "sourceIds": [
        "src.ccc.main",
        "src.vatican2.gaudium-et-spes"
      ]
    },
    {
      "type": "paragraph",
      "text": "For Object, Intention, Circumstances, Virtue, and Conscience, recall communion. Moral Life and Prayer Foundations uses communion in this lesson. Link communion with Foundations in Object, Intention, Circumstances, Virtue, and Conscience. Classify every communion claim in Object, Intention, Circumstances, Virtue, and Conscience. Check communion evidence for Moral Life and Prayer Foundations. Revise Object, Intention, Circumstances, Virtue, and Conscience if communion remains unclear.",
      "sourceIds": [
        "src.ccc.main",
        "src.vatican2.gaudium-et-spes"
      ]
    },
    {
      "type": "paragraph",